Section,Category,Item,Detail
COMPETITOR ANALYSIS,Direct Competitors,Zulay Kitchen 13-Inch Danish Dough Whisk,"Brand: Zulay Kitchen | Price: $10 (Amazon) | Rating: 4.6/5 (3,978+ reviews) | Feature: Stainless steel hook + rubberwood handle, three-loop design | Platform: Amazon"
COMPETITOR ANALYSIS,Direct Competitors,Jillmo 12-Inch Stainless Steel Bread Whisk,"Brand: Jillmo | Price: $11 (Amazon) | Rating: 4.8/5 | Feature: 304 stainless steel wire head + stainless steel handle, dishwasher safe | Platform: Amazon"
COMPETITOR ANALYSIS,Direct Competitors,TEEVEA Danish Dough Whisk 13 Inch,"Brand: TEEVEA | Price: $14.49 (Amazon) | Rating: 4.6-4.8/5 (14,333 reviews) | Feature: 304 stainless steel coil + wooden handle, 2-year warranty | Platform: Amazon"
COMPETITOR ANALYSIS,Direct Competitors,OYV 304 Stainless Steel Dough Whisk 12 Inch,"Brand: OYV | Price: $7.99-8.39 (Amazon) | Rating: 4.7/5 | Feature: 304 SS 4-ring design, dishwasher safe, seamless construction | Platform: Amazon"
COMPETITOR ANALYSIS,Direct Competitors,Brod & Taylor Dough Whisk 13.5 Inch,"Brand: Brod & Taylor | Price: $14-18 (brand site + Amazon) | Rating: 5/5 | Feature: One-piece SS, silicone handle, extra-thick wire, dishwasher safe | Platform: Brand site / Amazon"
COMPETITOR ANALYSIS,Direct Competitors,IKEA VARDAGEN 10.25 Inch,"Brand: IKEA | Price: $7-10 | Rating: 4.9/5 (20 reviews) | Feature: Stainless steel + beechwood handle, hanging hole | Platform: IKEA"
COMPETITOR ANALYSIS,Direct Competitors,Tovolo 12.5 Inch SS Dough Whisk,"Brand: Tovolo | Price: $10-14 | Rating: N/A | Feature: Stainless steel, dishwasher safe, streamlined single-piece design | Platform: Target"
COMPETITOR ANALYSIS,Direct Competitors,Sur La Table Stainless Steel Dough Whisk,"Brand: Sur La Table | Price: $12-15 | Rating: N/A | Feature: Stainless steel, 11.5 inch, dishwasher safe | Platform: Sur La Table"
COMPETITOR ANALYSIS,Direct Competitors,U-Taste 12.6 Inch Danish Dough Whisk,"Brand: U-Taste | Price: $10-13 | Rating: 4.7/5 | Feature: 18/8 SS (304 equivalent), silicone handle, 3D 3-wire loops, seamless epoxy joints | Platform: Amazon + brand site"
COMPETITOR ANALYSIS,Direct Competitors,ALLTOP Danish Dough Whisk,"Brand: ALLTOP | Price: $8-11 | Rating: 4.6/5 | Feature: 430 SS (lower grade), wooden handle, three-loop design | Platform: Amazon"
COMPETITOR ANALYSIS,Direct Competitors,Norpro 3240 Scandinavian Dough Whisk,"Brand: Norpro | Price: $8-12 | Rating: 4.7/5 | Feature: SS + beechwood handle, 12 inch | Platform: Amazon / WebstaurantStore"
COMPETITOR ANALYSIS,Direct Competitors,Choice 13 Stainless Steel Danish Dough Whip,"Brand: Choice (WebstaurantStore) | Price: $6-8 | Rating: 4.5/5 | Feature: SS + wood handle, commercial grade, hand wash only | Platform: WebstaurantStore"
COMPETITOR ANALYSIS,Premium Competitors,Feinback Olive Wood Danish Dough Whisk,"Brand: Feinback | Price: $35-50 | Rating: 5/5 | Feature: Italian olive wood handle, 304 SS, lifetime warranty, gift packaging | Platform: Brand site"
COMPETITOR ANALYSIS,Premium Competitors,Zulay Kitchen SS Danish Whisk (full steel),"Brand: Zulay Kitchen | Price: $15-22 | Rating: 4.6/5 | Feature: All stainless steel construction, three-loop | Platform: Zulay site + Amazon"
COMPETITOR ANALYSIS,Premium Competitors,DflowerK Premium Danish Dough Whisk,"Brand: DflowerK | Price: $12-15 | Rating: 4.5/5 | Feature: 18/8 (304) SS, oak wood handle, 3-eye hook | Platform: Amazon"
COMPETITOR ANALYSIS,Premium Competitors,COOKSURE Danish Dough Whisk (same product listed separately),"Brand: COOKSURE | Price: $9.99 (list $14.99) | Rating: N/A | Feature: 304 SS hook + wooden handle, 13 inch, sourdough-focused | Platform: Amazon"
COMPETITOR ANALYSIS,Direct Competitors,Fermentaholics Danish Dough Whisk,"Brand: Fermentaholics | Price: $10-13 | Rating: 4.6/5 | Feature: 403 SS (lower grade), wooden handle, three-loop | Platform: Brand site"
COMPETITOR ANALYSIS,Direct Competitors,Coson Home 2-Pack Danish Dough Whisk,"Brand: Coson Home | Price: $13-15 (2-pack) | Rating: 4.7/5 | Feature: 18/8 SS + oak handle, 13.5 inch, seamless design | Platform: Amazon"
COMPETITOR ANALYSIS,Direct Competitors,Maxjoy Danish Dough Whisk,"Brand: Maxjoy | Price: $9-12 | Rating: 4.8/5 (1,177 reviews) | Feature: SS + wooden handle | Platform: Amazon"
COMPETITOR ANALYSIS,Direct Competitors,Chef Michael Salmon 13 Inch Danish Dough Whisk,"Brand: Chef Michael Salmon | Price: $12-15 | Rating: N/A | Feature: High grade SS + food-grade wooden handle, three-loop flow-through | Platform: Brand site"
COMPETITOR ANALYSIS,Direct Competitors,Sourdough Science Danish Whisk,"Brand: Sourdough Science Academy | Price: $15.99 | Rating: N/A | Feature: SS + wooden handle, sourdough education focus | Platform: Brand site"
COMPETITOR ANALYSIS,Direct Competitors,Robyn on the Farm Danish Dough Whisk 13 Inch,"Brand: Robyn on the Farm | Price: $12-15 | Rating: N/A | Feature: SS head + smooth wooden handle, heavy duty | Platform: Brand site"
COMPETITOR ANALYSIS,Direct Competitors,GreenTek Essentials Dough Whisk,"Brand: GreenTek | Price: $10-13 | Rating: N/A | Feature: 304 SS, 3-circle design, 3mm wire, 11.33 inch | Platform: Brand site"
COMPETITOR ANALYSIS,Direct Competitors,Skinnytaste 13 Inch Danish Dough Whisk,"Brand: Skinnytaste | Price: $10-12 | Rating: 4.7/5 | Feature: SS + wood handle | Platform: Amazon"
COMPETITOR ANALYSIS,Direct Competitors,Olivvia Double Eyes Danish Dough Whisk,"Brand: Olivvia | Price: $6-8 | Rating: 4.7/5 (11 reviews) | Feature: 304 SS + wooden handle, double-eye design, dishwasher safe | Platform: Amazon UK"
COMPETITOR ANALYSIS,Direct Competitors,ThriveMart 10 Inch Danish Dough Whisk,"Brand: ThriveMart | Price: $4-6 | Rating: 5/5 (2 reviews) | Feature: SS + ergonomic handle, double-eye design | Platform: Amazon UK"
COMPETITOR ANALYSIS,Direct Competitors,ZHXKSH Seamless SS Dough Whisk,"Brand: ZHXKSH | Price: $10-14 | Rating: 4.9/5 (23 reviews) | Feature: Seamless one-piece SS, dishwasher safe | Platform: Amazon CA"
COMPETITOR ANALYSIS,Direct Competitors,Barlow & Co Danish Dough Hook,"Brand: Barlow & Co | Price: $45-65 | Rating: 5/5 | Feature: American hardwood handle, copper ferrule, heavy gauge SS, handmade in USA | Platform: Brand site"
COMPETITOR ANALYSIS,Direct Competitors,Floaty Goat Handmade Danish Whisk,"Brand: Floaty Goat Kitchen | Price: $30-40 | Rating: N/A | Feature: Sheffield steel, sustainably sourced timber, brass cuff, made in England | Platform: Brand site"
COMPETITOR ANALYSIS,Direct Competitors,Flour + Water Baking Danish Whisk,"Brand: Flour + Water Baking | Price: $25-35 | Rating: N/A | Feature: Oak wood handle + SS hoops, 33cm, hand wash only | Platform: Brand site"
COMPETITOR ANALYSIS,Direct Competitors,Janie's Mill Danish Dough Whisk,"Brand: Janie's Mill | Price: $15-20 | Rating: N/A | Feature: SS + laser-engraved wooden handle, artisan branding | Platform: Brand site"
COMPETITOR ANALYSIS,Direct Competitors,The Everyday Shoppe 13 Inch Danish Whisk,"Brand: The Everyday Shoppe | Price: $12-16 | Rating: N/A | Feature: SS coil + solid wood handle, heart-shaped design | Platform: Brand site"
COMPETITOR ANALYSIS,Direct Competitors,Premium Stainless Steel Dutch Whisk (Baramati Mall),"Brand: Unbranded | Price: $8-12 | Rating: N/A | Feature: 304 SS, ergonomic handle, hanging hole | Platform: Baramati Mall"
COMPETITOR ANALYSIS,Pricing Context,Price Distribution Analysis,"45.21% of all dough whisk ASINs on Amazon fall in $0-10 range. 56.59% have ratings 4.3-4.7. Top 3 ranked ASINs have 31.01% click-through and 31.80% conversion."
COMPETITOR ANALYSIS,Pricing Context,HARRY CORNER PRICE POSITION,"$9.99 puts the product in the sweet spot — above cheap unbranded options ($4-8) but below premium brands ($15-50). Competitive with Zulay ($10), Jillmo ($11), and TEEVEA ($14.49)."
COMPETITOR ANALYSIS,Pricing Context,KEY DIFFERENTIATOR,"Explicitly highlights 304 Stainless Steel Hook — most competitors just say 'stainless steel' or 'food-grade.' This is a trust/quality signal for health-conscious and durability-focused buyers."
TONE & VOICE,Brand Voice,Brand Tone,"Warm, knowledgeable, approachable. Speaks like a trusted baking friend, not a corporate brand. Emphasizes quality materials and genuine baking expertise."
TONE & VOICE,Brand Voice,Brand Personality,"Practical artisan. Values craftsmanship and honest quality. Not pretentious, not cheap — just reliable tools for people who care about what they bake."
TONE & VOICE,Brand Voice,Do's,"Use active voice. Mention specific materials (304 SS, wooden handle). Reference sourdough community. Emphasize ease of cleaning. Show, don't just tell."
TONE & VOICE,Brand Voice,Donts,"Don't overpromise. Don't use medical claims. Don't disparage competitors by name. Don't use overly corporate jargon."
DEMOGRAPHICS,Target Market,Age Range,"25-55, core 30-45"
DEMOGRAPHICS,Target Market,Gender,"Skews female (60-65%) but growing male sourdough/bread community"
DEMOGRAPHICS,Target Market,Income,"$45K-$95K household, middle to upper-middle class"
DEMOGRAPHICS,Target Market,Location,"Urban/suburban US, strong in Pacific NW, Northeast, and Midwest bread-baking corridors"
DEMOGRAPHICS,Target Market,Education,"College-educated, information-seeking (reads reviews, watches YouTube tutorials)"
TARGET AUDIENCE FORMULA,Formula,Primary,"Sourdough enthusiasts who want quality tools without overpaying. They research before buying, value 304 stainless steel as a quality marker, and prefer hand tools over electric mixers."
TARGET AUDIENCE FORMULA,Formula,Secondary,"Gift buyers looking for affordable, practical kitchen gifts for bakers. The $9.99 price point and wooden handle aesthetic make it gift-ready."
TARGET AUDIENCE FORMULA,Formula,Tertiary,"Health-conscious home bakers who want food-grade, non-toxic materials. The '304 stainless steel' specification signals safety and durability."
TARGET AUDIENCE FORMULA,Formula,Pain Points,"Wooden spoons get clogged with dough. Regular whisks trap thick dough. Electric mixers are overkill for bread. Existing whisks rust or bend. Hard to clean loops."
TARGET AUDIENCE FORMULA,Formula,Desired Outcomes,"Effortless dough mixing without sticky hands. Easy cleanup. Durable tool that won't rust or bend. Professional-looking results at home."
PERSONA 1,Persona 1,Sourdough Sarah,"Age: 34 | Location: Portland, OR | Income: $75K | Occupation: Marketing manager | Baking frequency: 3-4x/week, primarily sourdough | Shopping behavior: Reads Serious Eats, watches YouTube sourdough channels, checks Amazon reviews extensively | Pain points: Current wooden spoon gets clogged, dough sticks to everything, wants to reduce kitchen tool clutter | Purchase drivers: 304 stainless steel quality marker, sourdough-specific marketing, wooden handle aesthetics, easy cleaning | Willingness to pay: $10-20 for a quality tool | Social: Active in r/Sourdough, posts on Instagram | Key quote: I want something that actually works for high-hydration dough without a 20-minute cleanup"
PERSONA 2,Persona 2,Gift-Giving Greg,"Age: 42 | Location: Chicago, IL | Income: $95K | Occupation: IT project manager | Baking frequency: Weekend baker, bread + cookies | Shopping behavior: Buys gifts for wife/daughter who bake, shops Amazon for convenience, price-conscious but not cheap | Pain points: Doesn't know what makes a good baking tool, needs clear feature callouts | Purchase drivers: Clear product description, gift-ready appearance, trusted brand, reasonable price | Willingness to pay: $8-15 for a gift | Social: Not active in baking communities | Key quote: I just need something that looks nice and works — don't want to overthink it"
PERSONA 3,Persona 3,Newbie Nora,"Age: 27 | Location: Austin, TX | Income: $52K | Occupation: Graphic designer | Baking frequency: Monthly, learning sourdough | Shopping behavior: Browses TikTok for baking trends, buys based on aesthetics + reviews, impulse-friendly price range | Pain points: Overwhelmed by options, doesn't understand SS grades, needs education | Purchase drivers: Attractive wooden handle, clear '304 stainless steel' quality signal, positive reviews, Instagram-worthy | Willingness to pay: $5-12, price-sensitive | Social: Follows baking influencers on TikTok | Key quote: I saw this on TikTok and want to try sourdough — what do I actually need?"
RESEARCH QUESTIONS,Questions,Product-Market Fit,"Is '304 stainless steel' a strong enough differentiator to command a premium over generic 'stainless steel' products? (Answer: Yes — it's a recognized quality marker among informed buyers)"
RESEARCH QUESTIONS,Questions,Competitive Gap,"Most competitors don't explicitly call out '304' in their titles. This creates an SEO and trust advantage for Harry Corner's listing."
RESEARCH QUESTIONS,Questions,Price Sensitivity,"At $9.99, the product is priced at the median for the category. There's room to test $11.99 if reviews are strong."
RESEARCH QUESTIONS,Questions,Channel Opportunity,"Strong organic search volume for '304 stainless steel dough whisk' — competitors rank well with less specific messaging."
RESEARCH QUESTIONS,Questions,Content Opportunity,"Sourdough education content (how-to, recipe integration) could differentiate from purely product-focused competitors."
RESEARCH QUESTIONS,Questions,Review Strategy,"Competitors with 4.7+ stars dominate. Early review generation is critical — target 25+ reviews in first 60 days."
MARKET INSIGHTS,Insight 1,Category Growth,"Danish dough whisk category is growing with the sourdough/home bread movement. Amazon data shows top sellers moving 9,000+ units/month."
MARKET INSIGHTS,Insight 2,Material Matters,"304 stainless steel is the premium standard for food-grade tools. Competitors using 403 SS (ALLTOP, Fermentaholics) are positioned lower on quality."
MARKET INSIGHTS,Insight 3,Handle Trend,"Wooden handles dominate (aesthetic, eco-friendly appeal). Silicone handles (Brod & Taylor, U-Taste) are the premium alternative. Full steel handles are less common."
MARKET INSIGHTS,Insight 4,Cleaning is #1,"Dishwasher safety and easy cleaning are the most mentioned features in reviews. Products with seamless designs get better cleaning feedback."
MARKET INSIGHTS,Insight 5,Size Standard,"13 inch is the standard size. 12 inch and 10 inch variants exist but are less popular. 15 inch is considered oversized."
MARKET INSIGHTS,Insight 6,Review Volume,"TEEVEA leads with 14,333 reviews. Maxjoy has 1,177. Most competitors have under 500. Review count is a major ranking factor."
MARKET INSIGHTS,Insight 7,Content Gap,"Few competitors leverage sourdough education content. Most listings are purely transactional. Opportunity to differentiate with recipe integration."
MARKET INSIGHTS,Insight 8,Multi-Pack Opportunity,"Coson Home's 2-pack at $13-15 is popular for gifting. Single units at $10 are the norm."
STRATEGY,SEO Strategy,Primary Keywords,"danish dough whisk, 304 stainless steel dough whisk, bread whisk sourdough, sourdough dough whisk"
STRATEGY,SEO Strategy,Long-tail Keywords,"304 stainless steel hook dough whisk, heavy duty dough whisk for sourdough, professional grade bread whisk wooden handle"
STRATEGY,SEO Strategy,Content Strategy,"Create baking how-to content around sourdough mixing techniques, positioning Harry Corner as an authority, not just a product."
STRATEGY,Listing Optimization,Title,"Lead with '304 Stainless Steel' — it's the differentiator. Include 'sourdough' and '13 inch' for search. Example: '304 Stainless Steel Hook Danish Dough Whisk for Sourdough Bread – 13 Inch with Wooden Handle – Heavy Duty Bread Whisk'"
STRATEGY,Listing Optimization,Bullets,"1) 304 Stainless Steel quality marker 2) 13-inch ergonomic wooden handle 3) Heavy dough performance 4) Easy to clean 5) Versatile (sourdough, pizza, cookies)"
STRATEGY,Listing Optimization,Images,"1) Hero shot on white 2) In-use mixing sourdough 3) Close-up of 304 SS hook 4) Size reference 5) Cleaning demo 6) Lifestyle in kitchen"
STRATEGY,Listing Optimization,A+ Content,"Comparison chart vs. generic whisks. Material callout (304 vs 430 SS). Sourdough recipe card. Cleaning guide."
STRATEGY,Pricing Strategy,Recommended Price,"$9.99 is well-positioned. Consider $11.99 with a coupon for perceived value. Bundle opportunity: whisk + scraper at $16.99."
STRATEGY,Review Strategy,Launch Plan,"Request inserts in packaging for review requests. Follow up via Amazon's Request a Review button. Target 25+ reviews in 60 days."
STRATEGY,Advertising Strategy,PPC Focus,"Sponsored Products for: 'danish dough whisk', '304 stainless steel dough whisk', 'sourdough bread tools'. Auto campaigns for discovery. Budget: $15-25/day initially."
